[
  {
    "weather_station_id": "WS-0001",
    "farm_id": "FARM0001",
    "observed_at": "2024-03-19",
    "air_temperature_celsius": 17.79,
    "relative_humidity_percentage": 77.03,
    "rainfall_millimeters": 75.62,
    "sunlight_duration_hours": 7.27,
    "wind_speed_kmh": 6.7,
    "atmospheric_pressure_hpa": 997.3,
    "latitude": 14.970941,
    "longitude": 82.997689
  },
  {
    "weather_station_id": "WS-0002",
    "farm_id": "FARM0002",
    "observed_at": "2024-04-21",
    "air_temperature_celsius": 30.18,
    "relative_humidity_percentage": 61.13,
    "rainfall_millimeters": 89.91,
    "sunlight_duration_hours": 5.67,
    "wind_speed_kmh": 8.4,
    "atmospheric_pressure_hpa": 999.6,
    "latitude": 16.613022,
    "longitude": 70.869009
  },
  {
    "weather_station_id": "WS-0003",
    "farm_id": "FARM0003",
    "observed_at": "2024-02-28",
    "air_temperature_celsius": 27.37,
    "relative_humidity_percentage": 68.87,
    "rainfall_millimeters": 265.43,
    "sunlight_duration_hours": 8.23,
    "wind_speed_kmh": 10.1,
    "atmospheric_pressure_hpa": 1001.9,
    "latitude": 19.503156,
    "longitude": 79.068206
  },
  {
    "weather_station_id": "WS-0004",
    "farm_id": "FARM0004",
    "observed_at": "2024-05-14",
    "air_temperature_celsius": 33.73,
    "relative_humidity_percentage": 70.46,
    "rainfall_millimeters": 212.01,
    "sunlight_duration_hours": 5.03,
    "wind_speed_kmh": 11.8,
    "atmospheric_pressure_hpa": 1004.2,
    "latitude": 31.071298,
    "longitude": 85.519998
  },
  {
    "weather_station_id": "WS-0005",
    "farm_id": "FARM0005",
    "observed_at": "2024-04-13",
    "air_temperature_celsius": 33.86,
    "relative_humidity_percentage": 55.73,
    "rainfall_millimeters": 269.09,
    "sunlight_duration_hours": 7.93,
    "wind_speed_kmh": 13.5,
    "atmospheric_pressure_hpa": 1006.5,
    "latitude": 16.56854,
    "longitude": 81.69172
  },
  {
    "weather_station_id": "WS-0006",
    "farm_id": "FARM0006",
    "observed_at": "2024-03-12",
    "air_temperature_celsius": 24.87,
    "relative_humidity_percentage": 83.06,
    "rainfall_millimeters": 238.95,
    "sunlight_duration_hours": 4.92,
    "wind_speed_kmh": 15.2,
    "atmospheric_pressure_hpa": 1008.8,
    "latitude": 23.227859,
    "longitude": 89.421568
  },
  {
    "weather_station_id": "WS-0007",
    "farm_id": "FARM0007",
    "observed_at": "2024-07-11",
    "air_temperature_celsius": 21.8,
    "relative_humidity_percentage": 47.91,
    "rainfall_millimeters": 123.38,
    "sunlight_duration_hours": 4.02,
    "wind_speed_kmh": 16.9,
    "atmospheric_pressure_hpa": 1011.1,
    "latitude": 25.224255,
    "longitude": 73.056785
  },
  {
    "weather_station_id": "WS-0008",
    "farm_id": "FARM0008",
    "observed_at": "2024-04-30",
    "air_temperature_celsius": 22.26,
    "relative_humidity_percentage": 80.34,
    "rainfall_millimeters": 296.33,
    "sunlight_duration_hours": 5.44,
    "wind_speed_kmh": 18.6,
    "atmospheric_pressure_hpa": 1013.4,
    "latitude": 23.317654,
    "longitude": 72.51521
  },
  {
    "weather_station_id": "WS-0009",
    "farm_id": "FARM0009",
    "observed_at": "2024-05-08",
    "air_temperature_celsius": 19.24,
    "relative_humidity_percentage": 76.5,
    "rainfall_millimeters": 184.82,
    "sunlight_duration_hours": 5.21,
    "wind_speed_kmh": 20.3,
    "atmospheric_pressure_hpa": 1015.7,
    "latitude": 13.025105,
    "longitude": 74.493947
  },
  {
    "weather_station_id": "WS-0010",
    "farm_id": "FARM0010",
    "observed_at": "2024-03-31",
    "air_temperature_celsius": 16.18,
    "relative_humidity_percentage": 41.57,
    "rainfall_millimeters": 66.85,
    "sunlight_duration_hours": 5.98,
    "wind_speed_kmh": 22.0,
    "atmospheric_pressure_hpa": 1018.0,
    "latitude": 24.405291,
    "longitude": 74.859945
  },
  {
    "weather_station_id": "WS-0011",
    "farm_id": "FARM0011",
    "observed_at": "2024-04-15",
    "air_temperature_celsius": 23.47,
    "relative_humidity_percentage": 76.45,
    "rainfall_millimeters": 166.76,
    "sunlight_duration_hours": 8.04,
    "wind_speed_kmh": 23.7,
    "atmospheric_pressure_hpa": 1020.3,
    "latitude": 14.755223,
    "longitude": 78.972271
  },
  {
    "weather_station_id": "WS-0012",
    "farm_id": "FARM0012",
    "observed_at": "2024-02-02",
    "air_temperature_celsius": 31.16,
    "relative_humidity_percentage": 44.9,
    "rainfall_millimeters": 263.99,
    "sunlight_duration_hours": 7.91,
    "wind_speed_kmh": 25.4,
    "atmospheric_pressure_hpa": 1022.6,
    "latitude": 31.61626,
    "longitude": 88.048857
  },
  {
    "weather_station_id": "WS-0013",
    "farm_id": "FARM0013",
    "observed_at": "2024-01-17",
    "air_temperature_celsius": 20.7,
    "relative_humidity_percentage": 76.53,
    "rainfall_millimeters": 224.15,
    "sunlight_duration_hours": 8.7,
    "wind_speed_kmh": 27.1,
    "atmospheric_pressure_hpa": 1024.9,
    "latitude": 28.699389,
    "longitude": 71.143305
  },
  {
    "weather_station_id": "WS-0014",
    "farm_id": "FARM0014",
    "observed_at": "2024-05-14",
    "air_temperature_celsius": 26.9,
    "relative_humidity_percentage": 51.76,
    "rainfall_millimeters": 218.8,
    "sunlight_duration_hours": 4.72,
    "wind_speed_kmh": 28.8,
    "atmospheric_pressure_hpa": 997.2,
    "latitude": 23.069568,
    "longitude": 88.694125
  },
  {
    "weather_station_id": "WS-0015",
    "farm_id": "FARM0015",
    "observed_at": "2024-02-05",
    "air_temperature_celsius": 21.0,
    "relative_humidity_percentage": 77.59,
    "rainfall_millimeters": 129.04,
    "sunlight_duration_hours": 4.44,
    "wind_speed_kmh": 5.5,
    "atmospheric_pressure_hpa": 999.5,
    "latitude": 13.311414,
    "longitude": 76.980177
  },
  {
    "weather_station_id": "WS-0016",
    "farm_id": "FARM0016",
    "observed_at": "2024-03-10",
    "air_temperature_celsius": 29.07,
    "relative_humidity_percentage": 89.36,
    "rainfall_millimeters": 202.92,
    "sunlight_duration_hours": 7.92,
    "wind_speed_kmh": 7.2,
    "atmospheric_pressure_hpa": 1001.8,
    "latitude": 16.611648,
    "longitude": 87.794254
  },
  {
    "weather_station_id": "WS-0017",
    "farm_id": "FARM0017",
    "observed_at": "2024-02-18",
    "air_temperature_celsius": 19.07,
    "relative_humidity_percentage": 53.2,
    "rainfall_millimeters": 208.56,
    "sunlight_duration_hours": 6.93,
    "wind_speed_kmh": 8.9,
    "atmospheric_pressure_hpa": 1004.1,
    "latitude": 25.927834,
    "longitude": 75.239105
  },
  {
    "weather_station_id": "WS-0018",
    "farm_id": "FARM0018",
    "observed_at": "2024-02-22",
    "air_temperature_celsius": 28.82,
    "relative_humidity_percentage": 41.8,
    "rainfall_millimeters": 87.26,
    "sunlight_duration_hours": 6.22,
    "wind_speed_kmh": 10.6,
    "atmospheric_pressure_hpa": 1006.4,
    "latitude": 32.473116,
    "longitude": 74.201531
  },
  {
    "weather_station_id": "WS-0019",
    "farm_id": "FARM0019",
    "observed_at": "2024-05-13",
    "air_temperature_celsius": 27.41,
    "relative_humidity_percentage": 86.49,
    "rainfall_millimeters": 88.64,
    "sunlight_duration_hours": 9.19,
    "wind_speed_kmh": 12.3,
    "atmospheric_pressure_hpa": 1008.7,
    "latitude": 16.670143,
    "longitude": 85.74749
  },
  {
    "weather_station_id": "WS-0020",
    "farm_id": "FARM0020",
    "observed_at": "2024-03-30",
    "air_temperature_celsius": 21.99,
    "relative_humidity_percentage": 83.57,
    "rainfall_millimeters": 255.13,
    "sunlight_duration_hours": 5.34,
    "wind_speed_kmh": 14.0,
    "atmospheric_pressure_hpa": 1011.0,
    "latitude": 19.99196,
    "longitude": 89.622994
  },
  {
    "weather_station_id": "WS-0021",
    "farm_id": "FARM0021",
    "observed_at": "2024-03-28",
    "air_temperature_celsius": 20.31,
    "relative_humidity_percentage": 61.73,
    "rainfall_millimeters": 77.1,
    "sunlight_duration_hours": 8.37,
    "wind_speed_kmh": 15.7,
    "atmospheric_pressure_hpa": 1013.3,
    "latitude": 16.368063,
    "longitude": 84.175706
  },
  {
    "weather_station_id": "WS-0022",
    "farm_id": "FARM0022",
    "observed_at": "2024-04-21",
    "air_temperature_celsius": 21.6,
    "relative_humidity_percentage": 82.4,
    "rainfall_millimeters": 128.48,
    "sunlight_duration_hours": 8.32,
    "wind_speed_kmh": 17.4,
    "atmospheric_pressure_hpa": 1015.6,
    "latitude": 13.182195,
    "longitude": 78.408927
  },
  {
    "weather_station_id": "WS-0023",
    "farm_id": "FARM0023",
    "observed_at": "2024-06-30",
    "air_temperature_celsius": 15.01,
    "relative_humidity_percentage": 61.49,
    "rainfall_millimeters": 121.73,
    "sunlight_duration_hours": 7.48,
    "wind_speed_kmh": 19.1,
    "atmospheric_pressure_hpa": 1017.9,
    "latitude": 33.9958,
    "longitude": 84.719229
  },
  {
    "weather_station_id": "WS-0024",
    "farm_id": "FARM0024",
    "observed_at": "2024-06-15",
    "air_temperature_celsius": 30.02,
    "relative_humidity_percentage": 51.23,
    "rainfall_millimeters": 218.2,
    "sunlight_duration_hours": 5.19,
    "wind_speed_kmh": 20.8,
    "atmospheric_pressure_hpa": 1020.2,
    "latitude": 20.361025,
    "longitude": 82.595308
  },
  {
    "weather_station_id": "WS-0025",
    "farm_id": "FARM0025",
    "observed_at": "2024-04-17",
    "air_temperature_celsius": 15.11,
    "relative_humidity_percentage": 78.5,
    "rainfall_millimeters": 237.74,
    "sunlight_duration_hours": 4.64,
    "wind_speed_kmh": 22.5,
    "atmospheric_pressure_hpa": 1022.5,
    "latitude": 32.93675,
    "longitude": 72.427172
  },
  {
    "weather_station_id": "WS-0026",
    "farm_id": "FARM0026",
    "observed_at": "2024-05-06",
    "air_temperature_celsius": 32.83,
    "relative_humidity_percentage": 75.96,
    "rainfall_millimeters": 203.16,
    "sunlight_duration_hours": 7.03,
    "wind_speed_kmh": 24.2,
    "atmospheric_pressure_hpa": 1024.8,
    "latitude": 16.932784,
    "longitude": 85.553497
  },
  {
    "weather_station_id": "WS-0027",
    "farm_id": "FARM0027",
    "observed_at": "2024-04-18",